{
  "schemaVersion": "1.0.0",
  "topicId": "roman-topic-seo-20261013",
  "topicText": "SEO с Claude: возможности инструментов, расходы и ограничения",
  "revision": 2,
  "bodyText": "Claude можно подключить к SEO-инструментам, но у каждого своя задача. Первый — GSC MCP: даёт доступ\nк данным твоего сайта в Search Console, чтобы разобрать запросы, показы и клики. Для этого нужно\nотдельно настроить доступ Google. Второй — OpenSEO: помогает работать с ключами, позициями и\nбэклинками. Код открытый, но данные DataForSEO оплачиваются отдельно. Третий — GEO Optimizer:\nпроверяет признаки доступности и понятности страницы для поисковых систем с ИИ. Его рекомендации\nнужно перепроверять, а высокий балл не гарантирует цитирование. Практический результат — выбрать\nстраницу по данным, подтвердить проблему и получить список действий. Установка плагинов сама\nпо себе не исправляет сайт и не гарантирует рост трафика.",
  "hooks": [
    {
      "id": 1,
      "text": "Как с помощью Claude найти SEO-ошибки на своём сайте?"
    },
    {
      "id": 2,
      "text": "Сайт навайбкодил, а из поиска никто не приходит? Покажу, как проверить, что мешает Google находить твои страницы."
    },
    {
      "id": 3,
      "text": "Не знаешь, с чего начать SEO своего сайта? Покажу, какие ошибки проверить в первую очередь."
    }
  ],
  "endings": []
}
